{
  "issue": 99,
  "url": "https://github.com/owner/repo/issues/99",
  "fetched_at": "2026-06-26T13:50:53Z",
  "raw_body": "## 受入条件\n\n- [ ] something works\n",
  "body_hash": "af471a0279f38c03ad71532f12a658c4410980cdedaf50a542df6e5a13bbc6b2",
  "stable_acs": [
    {
      "id": "99-AC1",
      "text": "something works"
    }
  ]
}
